# tcpdump -n -i eth0
tcpdump: verbose output suppressed, use -v or -vv for full protocol decode
listening on eth0, link-type EN10MB (Ethernet), capture size 262144 bytes
15:19:33.151028 IP 134.122.43.154.22 > 173.34.118.9.53334: Flags [P.], seq 2708389458:2708389494, ack 2730343213, win 501, options [nop,nop,TS val 901315392 ecr 996405010], length 36
15:19:33.152823 IP 134.122.43.154.22 > 173.34.118.9.53334: Flags [P.], seq 36:144, ack 1, win 501, options [nop,nop,TS val 901315394 ecr 996405010], length 108
15:19:33.152868 IP 134.122.43.154.22 > 173.34.118.9.53334: Flags [P.], seq 144:180, ack 1, win 501, options [nop,nop,TS val 901315394 ecr 996405010], length 36
15:19:33.152902 IP 134.122.43.154.22 > 173.34.118.9.53334: Flags [P.], seq 180:288, ack 1, win 501, options [nop,nop,TS val 901315394 ecr 996405010], length 108
15:19:33.152929 IP 134.122.43.154.22 > 173.34.118.9.53334: Flags [P.], seq 288:324, ack 1, win 501, options [nop,nop,TS val 901315394 ecr 996405010], length 36
15:19:33.153017 IP 134.122.43.154.22 > 173.34.118.9.53334: Flags [P.], seq 324:544, ack 1, win 501, options [nop,nop,TS val 901315394 ecr 996405010], length 220
15:19:33.153046 IP 134.122.43.154.22 > 173.34.118.9.53334: Flags [P.], seq 544:580, ack 1, win 501, options [nop,nop,TS val 901315394 ecr 996405010], length 36
15:19:33.153081 IP 134.122.43.154.22 > 173.34.118.9.53334: Flags [P.], seq 580:776, ack 1, win 501, options [nop,nop,TS val 901315394 ecr 996405010], length 196
15:19:33.153108 IP 134.122.43.154.22 > 173.34.118.9.53334: Flags [P.], seq 776:812, ack 1, win 501, options [nop,nop,TS val 901315394 ecr 996405010], length 36
15:19:33.153142 IP 134.122.43.154.22 > 173.34.118.9.53334: Flags [P.], seq 812:1008, ack 1, win 501, options [nop,nop,TS val 901315394 ecr 996405010], length 196
15:19:33.163560 IP 173.34.118.9.53334 > 134.122.43.154.22: Flags [.], ack 1008, win 19725, options [nop,nop,TS val 996405026 ecr 901315394], length 0
15:19:33.163606 IP 134.122.43.154.22 > 173.34.118.9.53334: Flags [P.], seq 1008:2668, ack 1, win 501, options [nop,nop,TS val 901315405 ecr 996405026], length 1660
15:19:33.163735 IP 134.122.43.154.22 > 173.34.118.9.53334: Flags [P.], seq 2668:2856, ack 1, win 501, options [nop,nop,TS val 901315405 ecr 996405026], length 188
15:19:33.163772 IP 134.122.43.154.22 > 173.34.118.9.53334: Flags [P.], seq 2856:2892, ack 1, win 501, options [nop,nop,TS val 901315405 ecr 996405026], length 36
15:19:33.163810 IP 134.122.43.154.22 > 173.34.118.9.53334: Flags [P.], seq 2892:3096, ack 1, win 501, options [nop,nop,TS val 901315405 ecr 996405026], length 204
15:19:33.163837 IP 134.122.43.154.22 > 173.34.118.9.53334: Flags [P.], seq 3096:3132, ack 1, win 501, options [nop,nop,TS val 901315405 ecr 996405026], length 36
15:19:33.163872 IP 134.122.43.154.22 > 173.34.118.9.53334: Flags [P.], seq 3132:3328, ack 1, win 501, options [nop,nop,TS val 901315405 ecr 996405026], length 196
15:19:33.163897 IP 134.122.43.154.22 > 173.34.118.9.53334: Flags [P.], seq 3328:3364, ack 1, win 501, options [nop,nop,TS val 901315405 ecr 996405026], length 36
15:19:33.163930 IP 134.122.43.154.22 > 173.34.118.9.53334: Flags [P.], seq 3364:3560, ack 1, win 501, options [nop,nop,TS val 901315405 ecr 996405026], length 196
15:19:33.163964 IP 134.122.43.154.22 > 173.34.118.9.53334: Flags [P.], seq 3560:3596, ack 1, win 501, options [nop,nop,TS val 901315405 ecr 996405026], length 36
15:19:33.163997 IP 134.122.43.154.22 > 173.34.118.9.53334: Flags [P.], seq 3596:3792, ack 1, win 501, options [nop,nop,TS val 901315405 ecr 996405026], length 196
15:19:33.164023 IP 134.122.43.154.22 > 173.34.118.9.53334: Flags [P.], seq 3792:3828, ack 1, win 501, options [nop,nop,TS val 901315405 ecr 996405026], length 36
15:19:33.164056 IP 134.122.43.154.22 > 173.34.118.9.53334: Flags [P.], seq 3828:4024, ack 1, win 501, options [nop,nop,TS val 901315405 ecr 996405026], length 196
15:19:33.164082 IP 134.122.43.154.22 > 173.34.118.9.53334: Flags [P.], seq 4024:4060, ack 1, win 501, options [nop,nop,TS val 901315405 ecr 996405026], length 36
15:19:33.164115 IP 134.122.43.154.22 > 173.34.118.9.53334: Flags [P.], seq 4060:4256, ack 1, win 501, options [nop,nop,TS val 901315405 ecr 996405026], length 196
15:19:33.164140 IP 134.122.43.154.22 > 173.34.118.9.53334: Flags [P.], seq 4256:4292, ack 1, win 501, options [nop,nop,TS val 901315405 ecr 996405026], length 36
15:19:33.164173 IP 134.122.43.154.22 > 173.34.118.9.53334: Flags [P.], seq 4292:4488, ack 1, win 501, options [nop,nop,TS val 901315405 ecr 996405026], length 196
15:19:33.164200 IP 134.122.43.154.22 > 173.34.118.9.53334: Flags [P.], seq 4488:4524, ack 1, win 501, options [nop,nop,TS val 901315405 ecr 996405026], length 36
15:19:33.164233 IP 134.122.43.154.22 > 173.34.118.9.53334: Flags [P.], seq 4524:4720, ack 1, win 501, options [nop,nop,TS val 901315405 ecr 996405026], length 196
15:19:33.164258 IP 134.122.43.154.22 > 173.34.118.9.53334: Flags [P.], seq 4720:4756, ack 1, win 501, options [nop,nop,TS val 901315405 ecr 996405026], length 36
15:19:33.185866 IP 173.34.118.9.53334 > 134.122.43.154.22: Flags [.], ack 4756, win 19740, options [nop,nop,TS val 996405036 ecr 901315405], length 0
15:19:33.185921 IP 134.122.43.154.22 > 173.34.118.9.53334: Flags [P.], seq 4756:7308, ack 1, win 501, options [nop,nop,TS val 901315427 ecr 996405036], length 2552
15:19:33.186087 IP 134.122.43.154.22 > 173.34.118.9.53334: Flags [P.], seq 7308:7496, ack 1, win 501, options [nop,nop,TS val 901315427 ecr 996405036], length 188
15:19:33.186127 IP 134.122.43.154.22 > 173.34.118.9.53334: Flags [P.], seq 7496:7532, ack 1, win 501, options [nop,nop,TS val 901315427 ecr 996405036], length 36
15:19:33.186170 IP 134.122.43.154.22 > 173.34.118.9.53334: Flags [P.], seq 7532:7736, ack 1, win 501, options [nop,nop,TS val 901315427 ecr 996405036], length 204
15:19:33.186196 IP 134.122.43.154.22 > 173.34.118.9.53334: Flags [P.], seq 7736:7772, ack 1, win 501, options [nop,nop,TS val 901315427 ecr 996405036], length 36
15:19:33.186232 IP 134.122.43.154.22 > 173.34.118.9.53334: Flags [P.], seq 7772:7968, ack 1, win 501, options [nop,nop,TS val 901315427 ecr 996405036], length 196
15:19:33.186267 IP 134.122.43.154.22 > 173.34.118.9.53334: Flags [P.], seq 7968:8004, ack 1, win 501, options [nop,nop,TS val 901315427 ecr 996405036], length 36
15:19:33.186317 IP 134.122.43.154.22 > 173.34.118.9.53334: Flags [P.], seq 8004:8200, ack 1, win 501, options [nop,nop,TS val 901315427 ecr 996405036], length 196
15:19:33.186363 IP 134.122.43.154.22 > 173.34.118.9.53334: Flags [P.], seq 8200:8236, ack 1, win 501, options [nop,nop,TS val 901315427 ecr 996405036], length 36
15:19:33.186398 IP 134.122.43.154.22 > 173.34.118.9.53334: Flags [P.], seq 8236:8432, ack 1, win 501, options [nop,nop,TS val 901315428 ecr 996405036], length 196
15:19:33.186425 IP 134.122.43.154.22 > 173.34.118.9.53334: Flags [P.], seq 8432:8468, ack 1, win 501, options [nop,nop,TS val 901315428 ecr 996405036], length 36
15:19:33.186490 IP 134.122.43.154.22 > 173.34.118.9.53334: Flags [P.], seq 8468:8664, ack 1, win 501, options [nop,nop,TS val 901315428 ecr 996405036], length 196
15:19:33.186525 IP 134.122.43.154.22 > 173.34.118.9.53334: Flags [P.], seq 8664:8700, ack 1, win 501, options [nop,nop,TS val 901315428 ecr 996405036], length 36
15:19:33.186558 IP 134.122.43.154.22 > 173.34.118.9.53334: Flags [P.], seq 8700:8896, ack 1, win 501, options [nop,nop,TS val 901315428 ecr 996405036], length 196
15:19:33.186584 IP 134.122.43.154.22 > 173.34.118.9.53334: Flags [P.], seq 8896:8932, ack 1, win 501, options [nop,nop,TS val 901315428 ecr 996405036], length 36
15:19:33.186616 IP 134.122.43.154.22 > 173.34.118.9.53334: Flags [P.], seq 8932:9128, ack 1, win 501, options [nop,nop,TS val 901315428 ecr 996405036], length 196
15:19:33.186642 IP 134.122.43.154.22 > 173.34.118.9.53334: Flags [P.], seq 9128:9164, ack 1, win 501, options [nop,nop,TS val 901315428 ecr 996405036], length 36
15:19:33.186693 IP 134.122.43.154.22 > 173.34.118.9.53334: Flags [P.], seq 9164:9360, ack 1, win 501, options [nop,nop,TS val 901315428 ecr 996405036], length 196
15:19:33.186718 IP 134.122.43.154.22 > 173.34.118.9.53334: Flags [P.], seq 9360:9396, ack 1, win 501, options [nop,nop,TS val 901315428 ecr 996405036], length 36
15:19:33.186750 IP 134.122.43.154.22 > 173.34.118.9.53334: Flags [P.], seq 9396:9592, ack 1, win 501, options [nop,nop,TS val 901315428 ecr 996405036], length 196
15:19:33.186777 IP 134.122.43.154.22 > 173.34.118.9.53334: Flags [P.], seq 9592:9628, ack 1, win 501, options [nop,nop,TS val 901315428 ecr 996405036], length 36
15:19:33.186809 IP 134.122.43.154.22 > 173.34.118.9.53334: Flags [P.], seq 9628:9824, ack 1, win 501, options [nop,nop,TS val 901315428 ecr 996405036], length 196
15:19:33.186835 IP 134.122.43.154.22 > 173.34.118.9.53334: Flags [P.], seq 9824:9860, ack 1, win 501, options [nop,nop,TS val 901315428 ecr 996405036], length 36
15:19:33.186868 IP 134.122.43.154.22 > 173.34.118.9.53334: Flags [P.], seq 9860:10056, ack 1, win 501, options [nop,nop,TS val 901315428 ecr 996405036], length 196
15:19:33.186894 IP 134.122.43.154.22 > 173.34.118.9.53334: Flags [P.], seq 10056:10092, ack 1, win 501, options [nop,nop,TS val 901315428 ecr 996405036], length 36
15:19:33.186926 IP 134.122.43.154.22 > 173.34.118.9.53334: Flags [P.], seq 10092:10288, ack 1, win 501, options [nop,nop,TS val 901315428 ecr 996405036], length 196
15:19:33.186952 IP 134.122.43.154.22 > 173.34.118.9.53334: Flags [P.], seq 10288:10324, ack 1, win 501, options [nop,nop,TS val 901315428 ecr 996405036], length 36
15:19:33.186985 IP 134.122.43.154.22 > 173.34.118.9.53334: Flags [P.], seq 10324:10520, ack 1, win 501, options [nop,nop,TS val 901315428 ecr 996405036], length 196
15:19:33.187009 IP 134.122.43.154.22 > 173.34.118.9.53334: Flags [P.], seq 10520:10556, ack 1, win 501, options [nop,nop,TS val 901315428 ecr 996405036], length 36
15:19:33.187040 IP 134.122.43.154.22 > 173.34.118.9.53334: Flags [P.], seq 10556:10752, ack 1, win 501, options [nop,nop,TS val 901315428 ecr 996405036], length 196
15:19:33.187065 IP 134.122.43.154.22 > 173.34.118.9.53334: Flags [P.], seq 10752:10788, ack 1, win 501, options [nop,nop,TS val 901315428 ecr 996405036], length 36
15:19:33.187096 IP 134.122.43.154.22 > 173.34.118.9.53334: Flags [P.], seq 10788:10984, ack 1, win 501, options [nop,nop,TS val 901315428 ecr 996405036], length 196
15:19:33.187121 IP 134.122.43.154.22 > 173.34.118.9.53334: Flags [P.], seq 10984:11020, ack 1, win 501, options [nop,nop,TS val 901315428 ecr 996405036], length 36
15:19:33.187169 IP 134.122.43.154.22 > 173.34.118.9.53334: Flags [P.], seq 11020:11216, ack 1, win 501, options [nop,nop,TS val 901315428 ecr 996405036], length 196
15:19:33.187196 IP 134.122.43.154.22 > 173.34.118.9.53334: Flags [P.], seq 11216:11252, ack 1, win 501, options [nop,nop,TS val 901315428 ecr 996405036], length 36
15:19:33.187228 IP 134.122.43.154.22 > 173.34.118.9.53334: Flags [P.], seq 11252:11448, ack 1, win 501, options [nop,nop,TS val 901315428 ecr 996405036], length 196
15:19:33.187255 IP 134.122.43.154.22 > 173.34.118.9.53334: Flags [P.], seq 11448:11484, ack 1, win 501, options [nop,nop,TS val 901315428 ecr 996405036], length 36
15:19:33.187282 IP 134.122.43.154.22 > 173.34.118.9.53334: Flags [P.], seq 11484:11680, ack 1, win 501, options [nop,nop,TS val 901315428 ecr 996405036], length 196
15:19:33.187407 IP 134.122.43.154.22 > 173.34.118.9.53334: Flags [P.], seq 11680:12180, ack 1, win 501, options [nop,nop,TS val 901315429 ecr 996405036], length 500
15:19:33.198531 IP 173.34.118.9.53334 > 134.122.43.154.22: Flags [.], ack 11484, win 19635, options [nop,nop,TS val 996405058 ecr 901315428], length 0
15:19:33.198597 IP 134.122.43.154.22 > 173.34.118.9.53334: Flags [P.], seq 12180:16716, ack 1, win 501, options [nop,nop,TS val 901315440 ecr 996405058], length 4536
15:19:33.198738 IP 134.122.43.154.22 > 173.34.118.9.53334: Flags [P.], seq 16716:16904, ack 1, win 501, options [nop,nop,TS val 901315440 ecr 996405058], length 188
15:19:33.198774 IP 134.122.43.154.22 > 173.34.118.9.53334: Flags [P.], seq 16904:16940, ack 1, win 501, options [nop,nop,TS val 901315440 ecr 996405058], length 36
15:19:33.198812 IP 134.122.43.154.22 > 173.34.118.9.53334: Flags [P.], seq 16940:17144, ack 1, win 501, options [nop,nop,TS val 901315440 ecr 996405058], length 204
15:19:33.198839 IP 134.122.43.154.22 > 173.34.118.9.53334: Flags [P.], seq 17144:17180, ack 1, win 501, options [nop,nop,TS val 901315440 ecr 996405058], length 36
15:19:33.198874 IP 134.122.43.154.22 > 173.34.118.9.53334: Flags [P.], seq 17180:17384, ack 1, win 501, options [nop,nop,TS val 901315440 ecr 996405058], length 204
15:19:33.198900 IP 134.122.43.154.22 > 173.34.118.9.53334: Flags [P.], seq 17384:17420, ack 1, win 501, options [nop,nop,TS val 901315440 ecr 996405058], length 36
15:19:33.198933 IP 134.122.43.154.22 > 173.34.118.9.53334: Flags [P.], seq 17420:17624, ack 1, win 501, options [nop,nop,TS val 901315440 ecr 996405058], length 204
15:19:33.198960 IP 134.122.43.154.22 > 173.34.118.9.53334: Flags [P.], seq 17624:17660, ack 1, win 501, options [nop,nop,TS val 901315440 ecr 996405058], length 36
15:19:33.198999 IP 134.122.43.154.22 > 173.34.118.9.53334: Flags [P.], seq 17660:17864, ack 1, win 501, options [nop,nop,TS val 901315440 ecr 996405058], length 204
15:19:33.199036 IP 134.122.43.154.22 > 173.34.118.9.53334: Flags [P.], seq 17864:17900, ack 1, win 501, options [nop,nop,TS val 901315440 ecr 996405058], length 36
15:19:33.199072 IP 134.122.43.154.22 > 173.34.118.9.53334: Flags [P.], seq 17900:18104, ack 1, win 501, options [nop,nop,TS val 901315440 ecr 996405058], length 204
15:19:33.199100 IP 134.122.43.154.22 > 173.34.118.9.53334: Flags [P.], seq 18104:18140, ack 1, win 501, options [nop,nop,TS val 901315440 ecr 996405058], length 36
15:19:33.199137 IP 134.122.43.154.22 > 173.34.118.9.53334: Flags [P.], seq 18140:18344, ack 1, win 501, options [nop,nop,TS val 901315440 ecr 996405058], length 204
15:19:33.199173 IP 134.122.43.154.22 > 173.34.118.9.53334: Flags [P.], seq 18344:18380, ack 1, win 501, options [nop,nop,TS val 901315440 ecr 996405058], length 36
15:19:33.199219 IP 134.122.43.154.22 > 173.34.118.9.53334: Flags [P.], seq 18380:18584, ack 1, win 501, options [nop,nop,TS val 901315440 ecr 996405058], length 204
15:19:33.199249 IP 134.122.43.154.22 > 173.34.118.9.53334: Flags [P.], seq 18584:18620, ack 1, win 501, options [nop,nop,TS val 901315440 ecr 996405058], length 36
15:19:33.199296 IP 134.122.43.154.22 > 173.34.118.9.53334: Flags [P.], seq 18620:18824, ack 1, win 501, options [nop,nop,TS val 901315440 ecr 996405058], length 204
15:19:33.199331 IP 134.122.43.154.22 > 173.34.118.9.53334: Flags [P.], seq 18824:18860, ack 1, win 501, options [nop,nop,TS val 901315440 ecr 996405058], length 36
15:19:33.199395 IP 134.122.43.154.22 > 173.34.118.9.53334: Flags [P.], seq 18860:19064, ack 1, win 501, options [nop,nop,TS val 901315441 ecr 996405058], length 204
15:19:33.199468 IP 134.122.43.154.22 > 173.34.118.9.53334: Flags [P.], seq 19064:19340, ack 1, win 501, options [nop,nop,TS val 901315441 ecr 996405058], length 276
15:19:33.199486 IP 134.122.43.154.22 > 173.34.118.9.53334: Flags [P.], seq 19340:19544, ack 1, win 501, options [nop,nop,TS val 901315441 ecr 996405058], length 204
15:19:33.199513 IP 134.122.43.154.22 > 173.34.118.9.53334: Flags [P.], seq 19544:19580, ack 1, win 501, options [nop,nop,TS val 901315441 ecr 996405058], length 36
15:19:33.199547 IP 134.122.43.154.22 > 173.34.118.9.53334: Flags [P.], seq 19580:19784, ack 1, win 501, options [nop,nop,TS val 901315441 ecr 996405058], length 204
15:19:33.199575 IP 134.122.43.154.22 > 173.34.118.9.53334: Flags [P.], seq 19784:19820, ack 1, win 501, options [nop,nop,TS val 901315441 ecr 996405058], length 36
15:19:33.199626 IP 134.122.43.154.22 > 173.34.118.9.53334: Flags [P.], seq 19820:20024, ack 1, win 501, options [nop,nop,TS val 901315441 ecr 996405058], length 204
15:19:33.199665 IP 134.122.43.154.22 > 173.34.118.9.53334: Flags [P.], seq 20024:20060, ack 1, win 501, options [nop,nop,TS val 901315441 ecr 996405058], length 36
15:19:33.199721 IP 134.122.43.154.22 > 173.34.118.9.53334: Flags [P.], seq 20060:20264, ack 1, win 501, options [nop,nop,TS val 901315441 ecr 996405058], length 204
15:19:33.199748 IP 134.122.43.154.22 > 173.34.118.9.53334: Flags [P.], seq 20264:20300, ack 1, win 501, options [nop,nop,TS val 901315441 ecr 996405058], length 36
15:19:33.199783 IP 134.122.43.154.22 > 173.34.118.9.53334: Flags [P.], seq 20300:20504, ack 1, win 501, options [nop,nop,TS val 901315441 ecr 996405058], length 204
15:19:33.199819 IP 134.122.43.154.22 > 173.34.118.9.53334: Flags [P.], seq 20504:20540, ack 1, win 501, options [nop,nop,TS val 901315441 ecr 996405058], length 36
15:19:33.199863 IP 134.122.43.154.22 > 173.34.118.9.53334: Flags [P.], seq 20540:20744, ack 1, win 501, options [nop,nop,TS val 901315441 ecr 996405058], length 204
15:19:33.199896 IP 134.122.43.154.22 > 173.34.118.9.53334: Flags [P.], seq 20744:20780, ack 1, win 501, options [nop,nop,TS val 901315441 ecr 996405058], length 36
15:19:33.199940 IP 134.122.43.154.22 > 173.34.118.9.53334: Flags [P.], seq 20780:20984, ack 1, win 501, options [nop,nop,TS val 901315441 ecr 996405058], length 204
15:19:33.199978 IP 134.122.43.154.22 > 173.34.118.9.53334: Flags [P.], seq 20984:21020, ack 1, win 501, options [nop,nop,TS val 901315441 ecr 996405058], length 36
15:19:33.200018 IP 134.122.43.154.22 > 173.34.118.9.53334: Flags [P.], seq 21020:21224, ack 1, win 501, options [nop,nop,TS val 901315441 ecr 996405058], length 204
15:19:33.200045 IP 134.122.43.154.22 > 173.34.118.9.53334: Flags [P.], seq 21224:21260, ack 1, win 501, options [nop,nop,TS val 901315441 ecr 996405058], length 36
15:19:33.200078 IP 134.122.43.154.22 > 173.34.118.9.53334: Flags [P.], seq 21260:21464, ack 1, win 501, options [nop,nop,TS val 901315441 ecr 996405058], length 204
15:19:33.200106 IP 134.122.43.154.22 > 173.34.118.9.53334: Flags [P.], seq 21464:21500, ack 1, win 501, options [nop,nop,TS val 901315441 ecr 996405058], length 36
15:19:33.200150 IP 134.122.43.154.22 > 173.34.118.9.53334: Flags [P.], seq 21500:21704, ack 1, win 501, options [nop,nop,TS val 901315441 ecr 996405058], length 204
15:19:33.200177 IP 134.122.43.154.22 > 173.34.118.9.53334: Flags [P.], seq 21704:21740, ack 1, win 501, options [nop,nop,TS val 901315441 ecr 996405058], length 36
15:19:33.200218 IP 134.122.43.154.22 > 173.34.118.9.53334: Flags [P.], seq 21740:21944, ack 1, win 501, options [nop,nop,TS val 901315441 ecr 996405058], length 204
15:19:33.200251 IP 134.122.43.154.22 > 173.34.118.9.53334: Flags [P.], seq 21944:21980, ack 1, win 501, options [nop,nop,TS val 901315441 ecr 996405058], length 36
15:19:33.200300 IP 134.122.43.154.22 > 173.34.118.9.53334: Flags [P.], seq 21980:22184, ack 1, win 501, options [nop,nop,TS val 901315441 ecr 996405058], length 204
15:19:33.200326 IP 134.122.43.154.22 > 173.34.118.9.53334: Flags [P.], seq 22184:22220, ack 1, win 501, options [nop,nop,TS val 901315441 ecr 996405058], length 36
15:19:33.200454 IP 134.122.43.154.22 > 173.34.118.9.53334: Flags [P.], seq 22220:22424, ack 1, win 501, options [nop,nop,TS val 901315442 ecr 996405058], length 204
15:19:33.200498 IP 134.122.43.154.22 > 173.34.118.9.53334: Flags [P.], seq 22424:22460, ack 1, win 501, options [nop,nop,TS val 901315442 ecr 996405058], length 36
15:19:33.200541 IP 134.122.43.154.22 > 173.34.118.9.53334: Flags [P.], seq 22460:22664, ack 1, win 501, options [nop,nop,TS val 901315442 ecr 996405058], length 204
15:19:33.200567 IP 134.122.43.154.22 > 173.34.118.9.53334: Flags [P.], seq 22664:22700, ack 1, win 501, options [nop,nop,TS val 901315442 ecr 996405058], length 36
15:19:33.200600 IP 134.122.43.154.22 > 173.34.118.9.53334: Flags [P.], seq 22700:22904, ack 1, win 501, options [nop,nop,TS val 901315442 ecr 996405058], length 204
15:19:33.200631 IP 134.122.43.154.22 > 173.34.118.9.53334: Flags [P.], seq 22904:22940, ack 1, win 501, options [nop,nop,TS val 901315442 ecr 996405058], length 36
15:19:33.200679 IP 134.122.43.154.22 > 173.34.118.9.53334: Flags [P.], seq 22940:23144, ack 1, win 501, options [nop,nop,TS val 901315442 ecr 996405058], length 204
15:19:33.200710 IP 134.122.43.154.22 > 173.34.118.9.53334: Flags [P.], seq 23144:23180, ack 1, win 501, options [nop,nop,TS val 901315442 ecr 996405058], length 36
15:19:33.200743 IP 134.122.43.154.22 > 173.34.118.9.53334: Flags [P.], seq 23180:23384, ack 1, win 501, options [nop,nop,TS val 901315442 ecr 996405058], length 204
15:19:33.200781 IP 134.122.43.154.22 > 173.34.118.9.53334: Flags [P.], seq 23384:23420, ack 1, win 501, options [nop,nop,TS val 901315442 ecr 996405058], length 36
15:19:33.200843 IP 134.122.43.154.22 > 173.34.118.9.53334: Flags [P.], seq 23420:23624, ack 1, win 501, options [nop,nop,TS val 901315442 ecr 996405058], length 204
15:19:33.200893 IP 134.122.43.154.22 > 173.34.118.9.53334: Flags [P.], seq 23624:23660, ack 1, win 501, options [nop,nop,TS val 901315442 ecr 996405058], length 36
15:19:33.200947 IP 134.122.43.154.22 > 173.34.118.9.53334: Flags [P.], seq 23660:23864, ack 1, win 501, options [nop,nop,TS val 901315442 ecr 996405058], length 204
15:19:33.200976 IP 134.122.43.154.22 > 173.34.118.9.53334: Flags [P.], seq 23864:23900, ack 1, win 501, options [nop,nop,TS val 901315442 ecr 996405058], length 36
15:19:33.201022 IP 134.122.43.154.22 > 173.34.118.9.53334: Flags [P.], seq 23900:24104, ack 1, win 501, options [nop,nop,TS val 901315442 ecr 996405058], length 204
15:19:33.201064 IP 134.122.43.154.22 > 173.34.118.9.53334: Flags [P.], seq 24104:24140, ack 1, win 501, options [nop,nop,TS val 901315442 ecr 996405058], length 36
15:19:33.201110 IP 134.122.43.154.22 > 173.34.118.9.53334: Flags [P.], seq 24140:24344, ack 1, win 501, options [nop,nop,TS val 901315442 ecr 996405058], length 204
15:19:33.201170 IP 134.122.43.154.22 > 173.34.118.9.53334: Flags [P.], seq 24380:24584, ack 1, win 501, options [nop,nop,TS val 901315442 ecr 996405058], length 204
15:19:33.201280 IP 134.122.43.154.22 > 173.34.118.9.53334: Flags [P.], seq 24620:24824, ack 1, win 501, options [nop,nop,TS val 901315442 ecr 996405058], length 204
15:19:33.201342 IP 134.122.43.154.22 > 173.34.118.9.53334: Flags [P.], seq 24860:25064, ack 1, win 501, options [nop,nop,TS val 901315442 ecr 996405058], length 204
15:19:33.201413 IP 134.122.43.154.22 > 173.34.118.9.53334: Flags [P.], seq 25100:25304, ack 1, win 501, options [nop,nop,TS val 901315443 ecr 996405058], length 204
15:19:33.201493 IP 134.122.43.154.22 > 173.34.118.9.53334: Flags [P.], seq 25340:25544, ack 1, win 501, options [nop,nop,TS val 901315443 ecr 996405058], length 204
15:19:33.207168 IP 173.34.118.9.53334 > 134.122.43.154.22: Flags [.], ack 12180, win 19729, options [nop,nop,TS val 996405060 ecr 901315429], length 0
15:19:33.207202 IP 134.122.43.154.22 > 173.34.118.9.53334: Flags [P.], seq 25580:31372, ack 1, win 501, options [nop,nop,TS val 901315448 ecr 996405060], length 5792
15:19:33.214199 IP 173.34.118.9.53334 > 134.122.43.154.22: Flags [.], ack 21740, win 19591, options [nop,nop,TS val 996405070 ecr 901315441], length 0
15:19:33.214200 IP 173.34.118.9.53334 > 134.122.43.154.22: Flags [.], ack 25580, win 19740, options [nop,nop,TS val 996405071 ecr 901315443], length 0
15:19:33.214260 IP 134.122.43.154.22 > 173.34.118.9.53334: Flags [P.], seq 31372:33484, ack 1, win 501, options [nop,nop,TS val 901315455 ecr 996405070], length 2112
15:19:33.214395 IP 134.122.43.154.22 > 173.34.118.9.53334: Flags [P.], seq 33484:33672, ack 1, win 501, options [nop,nop,TS val 901315456 ecr 996405071], length 188
15:19:33.214431 IP 134.122.43.154.22 > 173.34.118.9.53334: Flags [P.], seq 33672:33708, ack 1, win 501, options [nop,nop,TS val 901315456 ecr 996405071], length 36
15:19:33.214468 IP 134.122.43.154.22 > 173.34.118.9.53334: Flags [P.], seq 33708:33896, ack 1, win 501, options [nop,nop,TS val 901315456 ecr 996405071], length 188
15:19:33.214494 IP 134.122.43.154.22 > 173.34.118.9.53334: Flags [P.], seq 33896:33932, ack 1, win 501, options [nop,nop,TS val 901315456 ecr 996405071], length 36
15:19:33.214529 IP 134.122.43.154.22 > 173.34.118.9.53334: Flags [P.], seq 33932:34136, ack 1, win 501, options [nop,nop,TS val 901315456 ecr 996405071], length 204
15:19:33.214555 IP 134.122.43.154.22 > 173.34.118.9.53334: Flags [P.], seq 34136:34172, ack 1, win 501, options [nop,nop,TS val 901315456 ecr 996405071], length 36
15:19:33.214589 IP 134.122.43.154.22 > 173.34.118.9.53334: Flags [P.], seq 34172:34376, ack 1, win 501, options [nop,nop,TS val 901315456 ecr 996405071], length 204
15:19:33.214616 IP 134.122.43.154.22 > 173.34.118.9.53334: Flags [P.], seq 34376:34412, ack 1, win 501, options [nop,nop,TS val 901315456 ecr 996405071], length 36
15:19:33.214661 IP 134.122.43.154.22 > 173.34.118.9.53334: Flags [P.], seq 34412:34616, ack 1, win 501, options [nop,nop,TS val 901315456 ecr 996405071], length 204
15:19:33.214691 IP 134.122.43.154.22 > 173.34.118.9.53334: Flags [P.], seq 34616:34652, ack 1, win 501, options [nop,nop,TS val 901315456 ecr 996405071], length 36
15:19:33.214724 IP 134.122.43.154.22 > 173.34.118.9.53334: Flags [P.], seq 34652:34856, ack 1, win 501, options [nop,nop,TS val 901315456 ecr 996405071], length 204
15:19:33.214757 IP 134.122.43.154.22 > 173.34.118.9.53334: Flags [P.], seq 34856:34892, ack 1, win 501, options [nop,nop,TS val 901315456 ecr 996405071], length 36
15:19:33.214789 IP 134.122.43.154.22 > 173.34.118.9.53334: Flags [P.], seq 34892:35096, ack 1, win 501, options [nop,nop,TS val 901315456 ecr 996405071], length 204
15:19:33.214815 IP 134.122.43.154.22 > 173.34.118.9.53334: Flags [P.], seq 35096:35132, ack 1, win 501, options [nop,nop,TS val 901315456 ecr 996405071], length 36
15:19:33.214848 IP 134.122.43.154.22 > 173.34.118.9.53334: Flags [P.], seq 35132:35336, ack 1, win 501, options [nop,nop,TS val 901315456 ecr 996405071], length 204
15:19:33.214875 IP 134.122.43.154.22 > 173.34.118.9.53334: Flags [P.], seq 35336:35372, ack 1, win 501, options [nop,nop,TS val 901315456 ecr 996405071], length 36
15:19:33.214908 IP 134.122.43.154.22 > 173.34.118.9.53334: Flags [P.], seq 35372:35576, ack 1, win 501, options [nop,nop,TS val 901315456 ecr 996405071], length 204
15:19:33.214935 IP 134.122.43.154.22 > 173.34.118.9.53334: Flags [P.], seq 35576:35612, ack 1, win 501, options [nop,nop,TS val 901315456 ecr 996405071], length 36
15:19:33.214969 IP 134.122.43.154.22 > 173.34.118.9.53334: Flags [P.], seq 35612:35816, ack 1, win 501, options [nop,nop,TS val 901315456 ecr 996405071], length 204
15:19:33.215005 IP 134.122.43.154.22 > 173.34.118.9.53334: Flags [P.], seq 35816:36020, ack 1, win 501, options [nop,nop,TS val 901315456 ecr 996405071], length 204
15:19:33.215064 IP 134.122.43.154.22 > 173.34.118.9.53334: Flags [P.], seq 36020:36552, ack 1, win 501, options [nop,nop,TS val 901315456 ecr 996405071], length 532
15:19:33.215125 IP 134.122.43.154.22 > 173.34.118.9.53334: Flags [P.], seq 36552:37252, ack 1, win 501, options [nop,nop,TS val 901315456 ecr 996405071], length 700
15:19:33.215185 IP 134.122.43.154.22 > 173.34.118.9.53334: Flags [P.], seq 37252:37952, ack 1, win 501, options [nop,nop,TS val 901315456 ecr 996405071], length 700
15:19:33.215238 IP 134.122.43.154.22 > 173.34.118.9.53334: Flags [P.], seq 37952:38484, ack 1, win 501, options [nop,nop,TS val 901315456 ecr 996405071], length 532
15:19:33.215292 IP 134.122.43.154.22 > 173.34.118.9.53334: Flags [P.], seq 38484:38856, ack 1, win 501, options [nop,nop,TS val 901315456 ecr 996405071], length 372
15:19:33.215331 IP 134.122.43.154.22 > 173.34.118.9.53334: Flags [P.], seq 38856:39060, ack 1, win 501, options [nop,nop,TS val 901315456 ecr 996405071], length 204
15:19:33.215370 IP 134.122.43.154.22 > 173.34.118.9.53334: Flags [P.], seq 39060:39264, ack 1, win 501, options [nop,nop,TS val 901315457 ecr 996405071], length 204
15:19:33.215409 IP 134.122.43.154.22 > 173.34.118.9.53334: Flags [P.], seq 39264:39468, ack 1, win 501, options [nop,nop,TS val 901315457 ecr 996405071], length 204
15:19:33.215448 IP 134.122.43.154.22 > 173.34.118.9.53334: Flags [P.], seq 39468:39672, ack 1, win 501, options [nop,nop,TS val 901315457 ecr 996405071], length 204
15:19:33.215486 IP 134.122.43.154.22 > 173.34.118.9.53334: Flags [P.], seq 39672:39876, ack 1, win 501, options [nop,nop,TS val 901315457 ecr 996405071], length 204
15:19:33.215525 IP 134.122.43.154.22 > 173.34.118.9.53334: Flags [P.], seq 39876:40080, ack 1, win 501, options [nop,nop,TS val 901315457 ecr 996405071], length 204
15:19:33.215563 IP 134.122.43.154.22 > 173.34.118.9.53334: Flags [P.], seq 40080:40284, ack 1, win 501, options [nop,nop,TS val 901315457 ecr 996405071], length 204
15:19:33.215601 IP 134.122.43.154.22 > 173.34.118.9.53334: Flags [P.], seq 40284:40488, ack 1, win 501, options [nop,nop,TS val 901315457 ecr 996405071], length 204
15:19:33.215639 IP 134.122.43.154.22 > 173.34.118.9.53334: Flags [P.], seq 40488:40692, ack 1, win 501, options [nop,nop,TS val 901315457 ecr 996405071], length 204
15:19:33.215678 IP 134.122.43.154.22 > 173.34.118.9.53334: Flags [P.], seq 40692:40896, ack 1, win 501, options [nop,nop,TS val 901315457 ecr 996405071], length 204
15:19:33.215716 IP 134.122.43.154.22 > 173.34.118.9.53334: Flags [P.], seq 40896:41100, ack 1, win 501, options [nop,nop,TS val 901315457 ecr 996405071], length 204
15:19:33.215754 IP 134.122.43.154.22 > 173.34.118.9.53334: Flags [P.], seq 41100:41304, ack 1, win 501, options [nop,nop,TS val 901315457 ecr 996405071], length 204
15:19:33.215793 IP 134.122.43.154.22 > 173.34.118.9.53334: Flags [P.], seq 41304:41508, ack 1, win 501, options [nop,nop,TS val 901315457 ecr 996405071], length 204
15:19:33.215836 IP 134.122.43.154.22 > 173.34.118.9.53334: Flags [P.], seq 41508:41712, ack 1, win 501, options [nop,nop,TS val 901315457 ecr 996405071], length 204
15:19:33.215897 IP 134.122.43.154.22 > 173.34.118.9.53334: Flags [P.], seq 41712:41916, ack 1, win 501, options [nop,nop,TS val 901315457 ecr 996405071], length 204
15:19:33.215953 IP 134.122.43.154.22 > 173.34.118.9.53334: Flags [P.], seq 41916:42120, ack 1, win 501, options [nop,nop,TS val 901315457 ecr 996405071], length 204
15:19:33.216005 IP 134.122.43.154.22 > 173.34.118.9.53334: Flags [P.], seq 42120:42324, ack 1, win 501, options [nop,nop,TS val 901315457 ecr 996405071], length 204
15:19:33.216048 IP 134.122.43.154.22 > 173.34.118.9.53334: Flags [P.], seq 42324:42528, ack 1, win 501, options [nop,nop,TS val 901315457 ecr 996405071], length 204
15:19:33.216093 IP 134.122.43.154.22 > 173.34.118.9.53334: Flags [P.], seq 42528:42732, ack 1, win 501, options [nop,nop,TS val 901315457 ecr 996405071], length 204
15:19:33.216141 IP 134.122.43.154.22 > 173.34.118.9.53334: Flags [P.], seq 42732:42936, ack 1, win 501, options [nop,nop,TS val 901315457 ecr 996405071], length 204
15:19:33.216193 IP 134.122.43.154.22 > 173.34.118.9.53334: Flags [P.], seq 42936:43140, ack 1, win 501, options [nop,nop,TS val 901315457 ecr 996405071], length 204
15:19:33.216234 IP 134.122.43.154.22 > 173.34.118.9.53334: Flags [P.], seq 43140:43344, ack 1, win 501, options [nop,nop,TS val 901315457 ecr 996405071], length 204
15:19:33.216274 IP 134.122.43.154.22 > 173.34.118.9.53334: Flags [P.], seq 43344:43548, ack 1, win 501, options [nop,nop,TS val 901315457 ecr 996405071], length 204
15:19:33.216328 IP 134.122.43.154.22 > 173.34.118.9.53334: Flags [P.], seq 43548:43752, ack 1, win 501, options [nop,nop,TS val 901315457 ecr 996405071], length 204
15:19:33.216368 IP 134.122.43.154.22 > 173.34.118.9.53334: Flags [P.], seq 43752:43956, ack 1, win 501, options [nop,nop,TS val 901315457 ecr 996405071], length 204
15:19:33.216407 IP 134.122.43.154.22 > 173.34.118.9.53334: Flags [P.], seq 43956:44160, ack 1, win 501, options [nop,nop,TS val 901315458 ecr 996405071], length 204
15:19:33.216446 IP 134.122.43.154.22 > 173.34.118.9.53334: Flags [P.], seq 44160:44364, ack 1, win 501, options [nop,nop,TS val 901315458 ecr 996405071], length 204
15:19:33.216485 IP 134.122.43.154.22 > 173.34.118.9.53334: Flags [P.], seq 44364:44568, ack 1, win 501, options [nop,nop,TS val 901315458 ecr 996405071], length 204
15:19:33.216524 IP 134.122.43.154.22 > 173.34.118.9.53334: Flags [P.], seq 44568:44772, ack 1, win 501, options [nop,nop,TS val 901315458 ecr 996405071], length 204
15:19:33.216573 IP 134.122.43.154.22 > 173.34.118.9.53334: Flags [P.], seq 44772:44976, ack 1, win 501, options [nop,nop,TS val 901315458 ecr 996405071], length 204
15:19:33.216613 IP 134.122.43.154.22 > 173.34.118.9.53334: Flags [P.], seq 44976:45180, ack 1, win 501, options [nop,nop,TS val 901315458 ecr 996405071], length 204
15:19:33.216651 IP 134.122.43.154.22 > 173.34.118.9.53334: Flags [P.], seq 45180:45384, ack 1, win 501, options [nop,nop,TS val 901315458 ecr 996405071], length 204
15:19:33.216701 IP 134.122.43.154.22 > 173.34.118.9.53334: Flags [P.], seq 45384:45588, ack 1, win 501, options [nop,nop,TS val 901315458 ecr 996405071], length 204
15:19:33.216751 IP 134.122.43.154.22 > 173.34.118.9.53334: Flags [P.], seq 45588:45792, ack 1, win 501, options [nop,nop,TS val 901315458 ecr 996405071], length 204
15:19:33.216793 IP 134.122.43.154.22 > 173.34.118.9.53334: Flags [P.], seq 45792:45996, ack 1, win 501, options [nop,nop,TS val 901315458 ecr 996405071], length 204
15:19:33.216832 IP 134.122.43.154.22 > 173.34.118.9.53334: Flags [P.], seq 45996:46200, ack 1, win 501, options [nop,nop,TS val 901315458 ecr 996405071], length 204
15:19:33.216882 IP 134.122.43.154.22 > 173.34.118.9.53334: Flags [P.], seq 46200:46404, ack 1, win 501, options [nop,nop,TS val 901315458 ecr 996405071], length 204
15:19:33.216935 IP 134.122.43.154.22 > 173.34.118.9.53334: Flags [P.], seq 46404:46608, ack 1, win 501, options [nop,nop,TS val 901315458 ecr 996405071], length 204
15:19:33.216983 IP 134.122.43.154.22 > 173.34.118.9.53334: Flags [P.], seq 46608:46812, ack 1, win 501, options [nop,nop,TS val 901315458 ecr 996405071], length 204
15:19:33.217129 IP 134.122.43.154.22 > 173.34.118.9.53334: Flags [P.], seq 46812:47016, ack 1, win 501, options [nop,nop,TS val 901315458 ecr 996405071], length 204
15:19:33.217180 IP 134.122.43.154.22 > 173.34.118.9.53334: Flags [P.], seq 47016:47220, ack 1, win 501, options [nop,nop,TS val 901315458 ecr 996405071], length 204
15:19:33.217219 IP 134.122.43.154.22 > 173.34.118.9.53334: Flags [P.], seq 47220:47424, ack 1, win 501, options [nop,nop,TS val 901315458 ecr 996405071], length 204
15:19:33.217258 IP 134.122.43.154.22 > 173.34.118.9.53334: Flags [P.], seq 47424:47628, ack 1, win 501, options [nop,nop,TS val 901315458 ecr 996405071], length 204
15:19:33.217305 IP 134.122.43.154.22 > 173.34.118.9.53334: Flags [P.], seq 47628:47832, ack 1, win 501, options [nop,nop,TS val 901315458 ecr 996405071], length 204
15:19:33.217344 IP 134.122.43.154.22 > 173.34.118.9.53334: Flags [P.], seq 47832:48036, ack 1, win 501, options [nop,nop,TS val 901315458 ecr 996405071], length 204
15:19:33.217382 IP 134.122.43.154.22 > 173.34.118.9.53334: Flags [P.], seq 48036:48240, ack 1, win 501, options [nop,nop,TS val 901315459 ecr 996405071], length 204
15:19:33.217420 IP 134.122.43.154.22 > 173.34.118.9.53334: Flags [P.], seq 48240:48444, ack 1, win 501, options [nop,nop,TS val 901315459 ecr 996405071], length 204
15:19:33.217458 IP 134.122.43.154.22 > 173.34.118.9.53334: Flags [P.], seq 48444:48648, ack 1, win 501, options [nop,nop,TS val 901315459 ecr 996405071], length 204
15:19:33.217495 IP 134.122.43.154.22 > 173.34.118.9.53334: Flags [P.], seq 48648:48852, ack 1, win 501, options [nop,nop,TS val 901315459 ecr 996405071], length 204
15:19:33.217532 IP 134.122.43.154.22 > 173.34.118.9.53334: Flags [P.], seq 48852:49056, ack 1, win 501, options [nop,nop,TS val 901315459 ecr 996405071], length 204
15:19:33.217570 IP 134.122.43.154.22 > 173.34.118.9.53334: Flags [P.], seq 49056:49260, ack 1, win 501, options [nop,nop,TS val 901315459 ecr 996405071], length 204
15:19:33.217607 IP 134.122.43.154.22 > 173.34.118.9.53334: Flags [P.], seq 49260:49464, ack 1, win 501, options [nop,nop,TS val 901315459 ecr 996405071], length 204
15:19:33.217644 IP 134.122.43.154.22 > 173.34.118.9.53334: Flags [P.], seq 49464:49668, ack 1, win 501, options [nop,nop,TS val 901315459 ecr 996405071], length 204
15:19:33.217682 IP 134.122.43.154.22 > 173.34.118.9.53334: Flags [P.], seq 49668:49872, ack 1, win 501, options [nop,nop,TS val 901315459 ecr 996405071], length 204
15:19:33.217738 IP 134.122.43.154.22 > 173.34.118.9.53334: Flags [P.], seq 49872:50076, ack 1, win 501, options [nop,nop,TS val 901315459 ecr 996405071], length 204
15:19:33.217776 IP 134.122.43.154.22 > 173.34.118.9.53334: Flags [P.], seq 50076:50280, ack 1, win 501, options [nop,nop,TS val 901315459 ecr 996405071], length 204
15:19:33.217816 IP 134.122.43.154.22 > 173.34.118.9.53334: Flags [P.], seq 50280:50484, ack 1, win 501, options [nop,nop,TS val 901315459 ecr 996405071], length 204
15:19:33.217855 IP 134.122.43.154.22 > 173.34.118.9.53334: Flags [P.], seq 50484:50688, ack 1, win 501, options [nop,nop,TS val 901315459 ecr 996405071], length 204
15:19:33.217893 IP 134.122.43.154.22 > 173.34.118.9.53334: Flags [P.], seq 50688:50892, ack 1, win 501, options [nop,nop,TS val 901315459 ecr 996405071], length 204
15:19:33.217934 IP 134.122.43.154.22 > 173.34.118.9.53334: Flags [P.], seq 50892:51096, ack 1, win 501, options [nop,nop,TS val 901315459 ecr 996405071], length 204
15:19:33.217974 IP 134.122.43.154.22 > 173.34.118.9.53334: Flags [P.], seq 51096:51300, ack 1, win 501, options [nop,nop,TS val 901315459 ecr 996405071], length 204
15:19:33.218014 IP 134.122.43.154.22 > 173.34.118.9.53334: Flags [P.], seq 51300:51504, ack 1, win 501, options [nop,nop,TS val 901315459 ecr 996405071], length 204
15:19:33.218052 IP 134.122.43.154.22 > 173.34.118.9.53334: Flags [P.], seq 51504:51708, ack 1, win 501, options [nop,nop,TS val 901315459 ecr 996405071], length 204
15:19:33.218090 IP 134.122.43.154.22 > 173.34.118.9.53334: Flags [P.], seq 51708:51912, ack 1, win 501, options [nop,nop,TS val 901315459 ecr 996405071], length 204
15:19:33.218129 IP 134.122.43.154.22 > 173.34.118.9.53334: Flags [P.], seq 51912:52116, ack 1, win 501, options [nop,nop,TS val 901315459 ecr 996405071], length 204
15:19:33.218166 IP 134.122.43.154.22 > 173.34.118.9.53334: Flags [P.], seq 52116:52320, ack 1, win 501, options [nop,nop,TS val 901315459 ecr 996405071], length 204
15:19:33.218205 IP 134.122.43.154.22 > 173.34.118.9.53334: Flags [P.], seq 52320:52524, ack 1, win 501, options [nop,nop,TS val 901315459 ecr 996405071], length 204
15:19:33.218246 IP 134.122.43.154.22 > 173.34.118.9.53334: Flags [P.], seq 52524:52728, ack 1, win 501, options [nop,nop,TS val 901315459 ecr 996405071], length 204
15:19:33.218284 IP 134.122.43.154.22 > 173.34.118.9.53334: Flags [P.], seq 52728:52932, ack 1, win 501, options [nop,nop,TS val 901315459 ecr 996405071], length 204
15:19:33.218323 IP 134.122.43.154.22 > 173.34.118.9.53334: Flags [P.], seq 52932:53136, ack 1, win 501, options [nop,nop,TS val 901315459 ecr 996405071], length 204
15:19:33.218363 IP 134.122.43.154.22 > 173.34.118.9.53334: Flags [P.], seq 53136:53340, ack 1, win 501, options [nop,nop,TS val 901315459 ecr 996405071], length 204
15:19:33.218401 IP 134.122.43.154.22 > 173.34.118.9.53334: Flags [P.], seq 53340:53544, ack 1, win 501, options [nop,nop,TS val 901315460 ecr 996405071], length 204
15:19:33.218440 IP 134.122.43.154.22 > 173.34.118.9.53334: Flags [P.], seq 53544:53748, ack 1, win 501, options [nop,nop,TS val 901315460 ecr 996405071], length 204
15:19:33.218478 IP 134.122.43.154.22 > 173.34.118.9.53334: Flags [P.], seq 53748:53952, ack 1, win 501, options [nop,nop,TS val 901315460 ecr 996405071], length 204
